{"schema_version":"1.0.0","adapter":{"id":"t480-transport","version":"0.1.0","contract_version":"1.0.0","title":"T480 Transport Safety","summary":"Validates bounded SSH targets for fixed T480 operations without opening a remote session.","status":"draft","owner":"Tool Repository","license":"Internal-Proprietary"},"value":{"use_cases":["Validate a fixed T480 target before an application operation."],"fit_for":["Bounded SSH transport preparation."],"not_for":["Arbitrary remote command execution."],"limitations":["Does not connect to a host or execute operations."]},"provenance":{"origin":{"source":"clean-room implementation informed by internal T480 transport behaviour","revision":"2026-08-29","license":"Internal-Proprietary","owner":"Tool Repository"},"changed_from":""},"capabilities":[{"name":"target_validation","description":"Validate a safe SSH target."}],"operations":[{"name":"validate_target","summary":"Validate one SSH target.","capability":"target_validation","input_schema":{"type":"object","required":["target"],"properties":{"target":{"type":"string","pattern":"^[A-Za-z0-9][A-Za-z0-9_.@:-]*$"}},"additionalProperties":false},"output_schema":{"type":"object","required":["target"],"properties":{"target":{"type":"string"}}},"side_effect":"read_only","idempotency":"idempotent","timeout_seconds":1,"retry_guidance":"No retry is required."}],"configuration":{"schema":{"type":"object","required":["target"],"properties":{"target":{"type":"string","pattern":"^[A-Za-z0-9][A-Za-z0-9_.@:-]*$"}},"additionalProperties":false},"secret_names":[]},"safety":{"data_classification":"internal","log_redaction":true,"destructive_opt_in":false},"health_check":{"operation":"validate_target","side_effect":"read_only"},"documentation":{"user_guide":"docs/adapters/t480-transport.md","knowledge_base":"adapters/t480-transport/knowledge.json"}}
