{
  "schema_version": "1.0.0",
  "adapter": {"id": "ollama-readiness", "version": "0.2.0", "contract_version": "1.0.0", "title": "T480 Ollama Readiness", "summary": "Compares the literal loopback Ollama inventory with the approved digest-pinned local model profile set.", "status": "active", "owner": "Tool Repository", "license": "Internal-Proprietary"},
  "value": {"use_cases": ["Verify the local T480 Ollama runtime before an approved local solution uses an approved model."], "fit_for": ["Read-only local inventory and exact digest readiness checks."], "not_for": ["Model installation, deletion, generation proxying, runtime reconfiguration, or any non-loopback endpoint."], "limitations": ["A consumer must explicitly provide the loopback probe; a successful check proves only the current local inventory."]},
  "provenance": {"origin": {"source": "clean-room implementation informed by /home/chris/projects/cs-ai-lab-infra/ollama/README.md", "revision": "551f1afe972172ba9eee707a81a12072c8473ee0", "license": "Internal-Proprietary", "owner": "Tool Repository"}, "changed_from": "No source code or configuration copied; reduced to a literal loopback, read-only inventory comparison against this repository's approved profile data."},
  "capabilities": [{"name": "local_model_readiness", "description": "Read and verify the approved local Ollama inventory."}],
  "operations": [{"name": "inspect_inventory", "summary": "Read the literal loopback inventory and compare exact approved model digests.", "capability": "local_model_readiness", "input_schema": {"type": "object", "additionalProperties": false}, "output_schema": {"type": "object", "required": ["target", "ready", "endpoint_scope", "checks", "models"], "additionalProperties": false, "properties": {"target": {"type": "string"}, "ready": {"type": "boolean"}, "endpoint_scope": {"const": "loopback_only"}, "checks": {"type": "object", "required": ["service_reachable", "approved_inventory"], "additionalProperties": false, "properties": {"service_reachable": {"type": "boolean"}, "approved_inventory": {"type": "boolean"}}}, "models": {"type": "array", "items": {"type": "object", "required": ["model", "digest"], "additionalProperties": false, "properties": {"model": {"type": "string"}, "digest": {"type": "string", "pattern": "^[a-f0-9]{64}$"}}}}}}, "side_effect": "read_only", "idempotency": "idempotent", "timeout_seconds": 10, "retry_guidance": "Retry after the local Ollama service is restored or the approved profile set is refreshed."}],
  "configuration": {"schema": {"type": "object", "required": ["target"], "properties": {"target": {"type": "string", "pattern": "^[A-Za-z0-9][A-Za-z0-9_.-]*$"}}, "additionalProperties": false}, "secret_names": []},
  "safety": {"data_classification": "internal", "log_redaction": true, "destructive_opt_in": false},
  "health_check": {"operation": "inspect_inventory", "side_effect": "read_only"},
  "documentation": {"user_guide": "docs/adapters/ollama-readiness.md", "knowledge_base": "adapters/ollama-readiness/knowledge.json"}
}
